{
  "schema_version": "n4a.native-capability-ledger/v1",
  "status": "inventory-complete-candidate",
  "scope": {
    "authority": "Native-backend V1 portability boundary (ADR-22) and four-release rollback mapping (ADR-24, 833d535)",
    "coverage": "Closed-world inventory of every model, operator, format and public API promised by the V1 candidate surface matrix. Each promise has an explicit native, plugin, refused or not-promised disposition, strict preflight and candidate-bound source evidence; unlisted promises are refused.",
    "exhaustive": true
  },
  "strict_profile": {
    "name": "strict",
    "unknown_entry": {
      "disposition": "refused",
      "decision": "refuse",
      "error_code": "unknown",
      "before": [
        "scientific_data_access",
        "result_write",
        "meaningful_compute"
      ]
    },
    "no_implicit_executable_default": true
  },
  "rollback_profile": {
    "name": "rollback-capable",
    "backend": "legacy",
    "native_default_release": true,
    "retention_releases": 2
  },
  "evolution_policy": {
    "governed_by": "ADR-02",
    "v1_extension_mode": "namespaced_optional_reader_ignore",
    "unknown_core_fields": "refuse",
    "future_major_dual_read": 1,
    "legacy_prediction_readable_releases": 2
  },
  "release_context": {
    "release_train": "2026.07-refactor",
    "inputs": {
      "aggregation_manifest": {
        "path": "docs/contracts/release/aggregation-manifest.n4a.json",
        "canonical_json_sha256": "sha256:27595d11c3ac9f1219e405e2888931ec9122f55fdd4c3968a2535615802ee34e"
      },
      "aggregation_lock": {
        "path": "docs/contracts/release/aggregation-lock.n4a.lock.json",
        "canonical_json_sha256": "sha256:e6baf0c1cdff75e5a83a59b9d500d047e0b4aaa76fd7cbf642341cb1a62ae684"
      },
      "surface_matrix": {
        "path": "docs/contracts/release/public-v1-surface-matrix.n4a.json",
        "canonical_json_sha256": "sha256:c2ce1e208109ffaed5be2820408cc78cfbcf13430552841640b92ce5b531182c"
      }
    }
  },
  "capabilities": [
    {
      "id": "split.kennard_stone",
      "kind": "operator",
      "aliases": [
        "nirs4all.operators.splitters.KennardStoneSplitter",
        "nirs4all.operators.splitters.splitters.KennardStoneSplitter"
      ],
      "language": "portable",
      "runtime": "portable-methods",
      "disposition": "native",
      "owner": {
        "repository": "nirs4all-methods",
        "component": "portable-pipeline"
      },
      "evidence": [
        {
          "candidate_key": "core",
          "commit": "b6442dc4334c62a2b6c72526bea554a734134ac6",
          "source": "compat/capabilities.toml",
          "source_sha256": "sha256:ba0d9ac83a143d1a475b0cc98df48590ee0d221c7b48f323a564a56979a46043",
          "claim": "The Core candidate descriptor limits the portable split promise to Kennard-Stone across the declared aggregate runtimes."
        }
      ],
      "runtime_assertions": [
        {
          "runtime": "python",
          "availability": "executable",
          "evidence_sources": [
            "compat/capabilities.toml"
          ]
        },
        {
          "runtime": "r",
          "availability": "executable",
          "evidence_sources": [
            "compat/capabilities.toml"
          ]
        },
        {
          "runtime": "javascript_wasm",
          "availability": "executable",
          "evidence_sources": [
            "compat/capabilities.toml"
          ]
        },
        {
          "runtime": "rust",
          "availability": "executable",
          "evidence_sources": [
            "compat/capabilities.toml"
          ]
        },
        {
          "runtime": "matlab_octave",
          "availability": "executable",
          "evidence_sources": [
            "compat/capabilities.toml"
          ]
        }
      ],
      "required_gates": {
        "core": [
          "core_pipeline_parity"
        ],
        "methods": [
          "methods_cross_binding_parity"
        ]
      },
      "preflight": {
        "profile": "strict",
        "decision": "allow_native",
        "before": [
          "scientific_data_access",
          "result_write",
          "meaningful_compute"
        ]
      },
      "disposition_scope": {
        "profile": "strict",
        "runtime": "portable-methods",
        "surface_ids": [
          "nirs4all.python.core",
          "nirs4all.r.aggregate",
          "nirs4all.javascript_wasm.aggregate",
          "nirs4all.rust.aggregate",
          "nirs4all.matlab_octave.aggregate"
        ]
      },
      "extensions": {}
    },
    {
      "id": "preprocess.snv",
      "kind": "operator",
      "aliases": [
        "nirs4all.operators.transforms.SNV",
        "nirs4all.operators.transforms.StandardNormalVariate",
        "nirs4all.operators.transforms.scalers.StandardNormalVariate"
      ],
      "language": "portable",
      "runtime": "portable-methods",
      "disposition": "native",
      "owner": {
        "repository": "nirs4all-methods",
        "component": "portable-pipeline"
      },
      "evidence": [
        {
          "candidate_key": "core",
          "commit": "b6442dc4334c62a2b6c72526bea554a734134ac6",
          "source": "compat/capabilities.toml",
          "source_sha256": "sha256:ba0d9ac83a143d1a475b0cc98df48590ee0d221c7b48f323a564a56979a46043",
          "claim": "The Core candidate descriptor records native SNV execution across the declared aggregate runtimes."
        }
      ],
      "runtime_assertions": [
        {
          "runtime": "python",
          "availability": "executable",
          "evidence_sources": [
            "compat/capabilities.toml"
          ]
        },
        {
          "runtime": "r",
          "availability": "executable",
          "evidence_sources": [
            "compat/capabilities.toml"
          ]
        },
        {
          "runtime": "javascript_wasm",
          "availability": "executable",
          "evidence_sources": [
            "compat/capabilities.toml"
          ]
        },
        {
          "runtime": "rust",
          "availability": "executable",
          "evidence_sources": [
            "compat/capabilities.toml"
          ]
        },
        {
          "runtime": "matlab_octave",
          "availability": "executable",
          "evidence_sources": [
            "compat/capabilities.toml"
          ]
        }
      ],
      "required_gates": {
        "core": [
          "core_pipeline_parity"
        ],
        "methods": [
          "methods_cross_binding_parity"
        ]
      },
      "preflight": {
        "profile": "strict",
        "decision": "allow_native",
        "before": [
          "scientific_data_access",
          "result_write",
          "meaningful_compute"
        ]
      },
      "disposition_scope": {
        "profile": "strict",
        "runtime": "portable-methods",
        "surface_ids": [
          "nirs4all.python.core",
          "nirs4all.r.aggregate",
          "nirs4all.javascript_wasm.aggregate",
          "nirs4all.rust.aggregate",
          "nirs4all.matlab_octave.aggregate"
        ]
      },
      "extensions": {}
    },
    {
      "id": "preprocess.savgol",
      "kind": "operator",
      "aliases": [
        "nirs4all.operators.transforms.SavitzkyGolay",
        "nirs4all.operators.transforms.nirs.SavitzkyGolay"
      ],
      "language": "portable",
      "runtime": "portable-methods",
      "disposition": "native",
      "owner": {
        "repository": "nirs4all-methods",
        "component": "portable-pipeline"
      },
      "evidence": [
        {
          "candidate_key": "core",
          "commit": "b6442dc4334c62a2b6c72526bea554a734134ac6",
          "source": "compat/capabilities.toml",
          "source_sha256": "sha256:ba0d9ac83a143d1a475b0cc98df48590ee0d221c7b48f323a564a56979a46043",
          "claim": "The Core candidate descriptor records native Savitzky-Golay execution across the declared aggregate runtimes."
        }
      ],
      "runtime_assertions": [
        {
          "runtime": "python",
          "availability": "executable",
          "evidence_sources": [
            "compat/capabilities.toml"
          ]
        },
        {
          "runtime": "r",
          "availability": "executable",
          "evidence_sources": [
            "compat/capabilities.toml"
          ]
        },
        {
          "runtime": "javascript_wasm",
          "availability": "executable",
          "evidence_sources": [
            "compat/capabilities.toml"
          ]
        },
        {
          "runtime": "rust",
          "availability": "executable",
          "evidence_sources": [
            "compat/capabilities.toml"
          ]
        },
        {
          "runtime": "matlab_octave",
          "availability": "executable",
          "evidence_sources": [
            "compat/capabilities.toml"
          ]
        }
      ],
      "required_gates": {
        "core": [
          "core_pipeline_parity"
        ],
        "methods": [
          "methods_cross_binding_parity"
        ]
      },
      "preflight": {
        "profile": "strict",
        "decision": "allow_native",
        "before": [
          "scientific_data_access",
          "result_write",
          "meaningful_compute"
        ]
      },
      "disposition_scope": {
        "profile": "strict",
        "runtime": "portable-methods",
        "surface_ids": [
          "nirs4all.python.core",
          "nirs4all.r.aggregate",
          "nirs4all.javascript_wasm.aggregate",
          "nirs4all.rust.aggregate",
          "nirs4all.matlab_octave.aggregate"
        ]
      },
      "extensions": {}
    },
    {
      "id": "model.pls_regression",
      "kind": "model",
      "aliases": [
        "sklearn.cross_decomposition.PLSRegression",
        "sklearn.cross_decomposition._pls.PLSRegression"
      ],
      "language": "portable",
      "runtime": "portable-methods",
      "disposition": "native",